{
  "format": "bonsai.ask/1",
  "id": "9c8b7a6f-5e4d-4c3b-8a29-1f0e9d8c7b6a",
  "at": "2026-10-08T14:22:05.000Z",
  "op": "file",
  "key": "agent:h-3e9f0a1b2c4d",
  "workspace": "ws-7kq2m4xw5r3t6y2u7p4a5c3e2b",
  "source": "agent",
  "session": "6d1e2f3a-4b5c-4d6e-8f7a-9b0c1d2e3f4a",
  "type": "Decide",
  "task": "T-0901",
  "doc": null,
  "title": "Which colour should the dark theme use for links?",
  "why": "The design file gives two blues and the contrast check passes for both.",
  "then_text": "The builder applies the chosen colour and reruns the contrast check.",
  "options": [
    "The lighter blue",
    "The darker blue"
  ],
  "verdict": null,
  "data": null,
  "answer": null
}
